{
  "schema_version": "1",
  "run_id": "fx-2-v2-run",
  "tool_version": "0.34.0",
  "kb": {
    "digest": "0594988c4eeb1d26846836007823a57782a4f4796b74082813caa890c1b5060b"
  },
  "stages": {
    "local": {
      "status": "complete",
      "run_id": "fx-2-v2-run",
      "started_utc": "2026-10-27T12:00:00Z",
      "consumed": [],
      "exit_code": 0,
      "finished_utc": "2026-10-27T12:00:00Z",
      "produced": []
    },
    "report": {
      "status": "complete",
      "run_id": "fx-2-v2-run",
      "started_utc": "2026-10-27T12:00:00Z",
      "consumed": [],
      "exit_code": 0,
      "finished_utc": "2026-10-27T12:00:00Z",
      "produced": [
        {
          "path": "findings.json",
          "schema": "findings-2"
        },
        {
          "path": "posture.json",
          "schema": "posture-1"
        },
        {
          "path": "report.md",
          "schema": null
        },
        {
          "path": "report.html",
          "schema": null
        }
      ]
    },
    "run": {
      "status": "complete",
      "run_id": "fx-2-v2-run",
      "started_utc": "2026-10-27T12:00:00Z",
      "consumed": [],
      "exit_code": 0,
      "finished_utc": "2026-10-27T12:00:00Z",
      "produced": [
        {
          "path": "inventory.json",
          "schema": "inventory-1"
        },
        {
          "path": "run-state.json",
          "schema": "run-state-1"
        }
      ]
    }
  },
  "files": [
    {
      "path": "findings.json",
      "schema": "findings-2",
      "sha256": "ba25ed5ebc7321189aa04e02f5ce4fbebc07d4888806c76cb5dee02b788e8735",
      "produced_by": "report"
    },
    {
      "path": "inventory.json",
      "schema": "inventory-1",
      "sha256": "041a6af546ac8efa0dd766d9ea48d3e3b2dd4df72a95fb41befaf1063701ffff",
      "produced_by": "run"
    },
    {
      "path": "posture.json",
      "schema": "posture-1",
      "sha256": "4b712d3e79ead06ec8b031cdb956fb2e0a9c8a460bf7577d3b888f702d25ffd3",
      "produced_by": "report"
    },
    {
      "path": "report.html",
      "schema": null,
      "sha256": "bfa2a569463b002efccc7771d7e9d6c1280bfe72ecff5a0452d88738bac3db67",
      "produced_by": "report"
    },
    {
      "path": "report.md",
      "schema": null,
      "sha256": "4fef619684906d8599e43ea268826165212229490b6a8cd4d283f8f4995afa3f",
      "produced_by": "report"
    },
    {
      "path": "run-state.json",
      "schema": "run-state-1",
      "sha256": "e588a92d2b8aa2488a672f33e8826e654a7be85c38495242351b2a00c4b4164d",
      "produced_by": "run"
    }
  ],
  "status": "complete"
}
